{
    "$schema": "urn:pickle:schemas:artefacts:domains:solution:conceptual:SOL-AIN",
    "audience": [
        "Enterprise Architect",
        "Solution Architect",
        "Product Owner"
    ],
    "author": [
        "Solution Architect"
    ],
    "documents": [
        {
            "id": "AIN-001",
            "title": "Analytical Platform Architecture Intent",
            "description": "Architecture intent for fedc's analytical platform modernisation, establishing the chosen direction for self-service analytics in response to ADR-013.",
            "status": "approved",
            "scope": "Self-Service Analytics initiative — the analytical platform layer covering ingestion, storage, transformation, and consumption of enterprise data. Directly aligned to ADR-013.",
            "executive-summary": {
                "summary": "This intent sets fedc's direction for analytical platform modernisation: a Databricks lakehouse as the enterprise data tier, with Oracle Analytics Cloud retained as the self-service BI layer.",
                "points": [
                    "Chosen over a full SaaS replacement (too costly and high-risk) and a native-OAC-only approach (no ML tier, cannot meet latency).",
                    "Event-driven ingestion from CC&B, MDM, and ERP via the Confluent event broker meets sub-15-minute latency targets.",
                    "Preserves existing OAC investment while adding an ML-ready tier governed by Unity Catalog."
                ]
            },
            "context": [
                {
                    "relationship": "informed-by",
                    "artefact-id": "SOL-AVI",
                    "document-id": "AVI-001",
                    "title": "Data & Analytics Vision"
                },
                {
                    "relationship": "informs",
                    "artefact-id": "SOL-SVI",
                    "document-id": "SVI-001",
                    "title": "Self-Service Analytics Solution Vision"
                }
            ],
            "stakeholders": [
                {
                    "id": "STK-001",
                    "name": "Chief Data Officer",
                    "role": "Accountable owner for the analytical platform direction",
                    "concerns": [
                        "CON-001",
                        "CON-003"
                    ]
                },
                {
                    "id": "STK-002",
                    "name": "Analytics & BI Team",
                    "role": "Owners of the OAC consumption layer and semantic models",
                    "concerns": [
                        "CON-002"
                    ]
                },
                {
                    "id": "STK-003",
                    "name": "Enterprise Architecture",
                    "role": "Custodians of platform standards and principle adherence",
                    "concerns": [
                        "CON-001",
                        "CON-004"
                    ]
                }
            ],
            "concerns": [
                {
                    "id": "CON-001",
                    "description": "The chosen direction must avoid stranding the existing Oracle Analytics Cloud investment.",
                    "type": "business"
                },
                {
                    "id": "CON-002",
                    "description": "The platform must serve both BI and ML workloads from a single governed tier.",
                    "type": "technical"
                },
                {
                    "id": "CON-003",
                    "description": "Ingestion latency must meet sub-15-minute operational targets.",
                    "type": "operational"
                },
                {
                    "id": "CON-004",
                    "description": "Data governance must be enforced centrally via Unity Catalog.",
                    "type": "regulatory"
                }
            ],
            "intent-statement": "fedc will adopt a lakehouse architecture on Databricks as its enterprise data platform, with Oracle Analytics Cloud (OAC) retained as the self-service consumption layer. Data will be ingested from Oracle CC&B, MDM, and ERP via event-driven pipelines through the Confluent event broker. This approach avoids replacing OAC (preserving existing user investment and training), while providing a modern, scalable storage and transformation tier that can serve both BI and ML workloads.",
            "background": "fedc's current analytical landscape is fragmented: operational reports are generated directly from Oracle CC&B via custom OBIEE dashboards, commercial teams extract data to Excel for modelling, and there is no governed enterprise data store. The Oracle Analytics Cloud (OAC) licence is underutilised — it is connected only to CC&B and lacks a governed semantic layer. ADR-013 has been raised to address this fragmentation. The architecture intent decision centres on how to modernise the platform: whether to invest in OAC natively, adopt a fully cloud-native SaaS alternative, or introduce a lakehouse tier beneath OAC.",
            "drivers": [
                {
                    "id": "DRV-001",
                    "description": "Business demand for self-service analytics is increasing — operational managers require real-time views of metering, payment, and grid data without IT-mediated report production.",
                    "type": "business"
                },
                {
                    "id": "DRV-002",
                    "description": "Ofgem half-hourly settlement mandates require sub-30-minute data latency for settlement-related datasets by 2027.",
                    "type": "regulatory"
                },
                {
                    "id": "DRV-003",
                    "description": "AI/ML workloads for churn prediction and predictive asset maintenance require a scalable, ML-ready data tier that CC&B cannot provide directly.",
                    "type": "technology"
                }
            ],
            "options-considered": [
                {
                    "id": "OPT-001",
                    "name": "Cloud-Native SaaS (e.g. Snowflake + Tableau)",
                    "description": "Replace the existing Oracle analytics stack with a cloud-native SaaS data warehouse (Snowflake) and a best-of-breed BI tool (Tableau or Power BI), migrating all existing OAC content.",
                    "pros": [
                        "Best-in-class SaaS scalability and managed infrastructure",
                        "Strong ecosystem for ML integration via Snowpark",
                        "Widely adopted in UK utilities sector"
                    ],
                    "cons": [
                        "High migration cost and risk — all existing OAC content and training is stranded",
                        "Oracle ERP and CC&B integration complexity on non-Oracle platforms",
                        "Additional licensing cost on top of existing Oracle contracts",
                        "18–24 month migration timeline before operational benefit"
                    ]
                },
                {
                    "id": "OPT-002",
                    "name": "Extend Oracle Analytics Cloud natively",
                    "description": "Invest in OAC's native data integration (Oracle Data Integrator) and semantic layer capabilities, connecting OAC directly to CC&B, MDM, and ERP without introducing a separate lakehouse tier.",
                    "pros": [
                        "Fully within existing Oracle contractual and support boundary",
                        "No new tooling — builds on existing OAC skills",
                        "Faster initial delivery for incremental BI use cases"
                    ],
                    "cons": [
                        "Oracle Data Integrator is not suited for real-time event-driven ingestion at scale",
                        "No native ML-ready data tier — Sagemaker and Databricks integration is complex",
                        "Limited support for open data formats (Delta Lake, Parquet) needed for ML feature stores",
                        "Perpetuates tight coupling to Oracle CC&B as the analytical source"
                    ]
                },
                {
                    "id": "OPT-003",
                    "name": "Lakehouse on Databricks with OAC as BI layer",
                    "description": "Introduce Databricks as the enterprise data lakehouse (Delta Lake, Unity Catalog for governance), feeding OAC via a semantic layer (OAC Data Gateway or direct Databricks SQL connector). Event-driven ingestion via Confluent.",
                    "pros": [
                        "Decouples BI consumption from source systems — OAC connects to governed lakehouse, not raw CC&B",
                        "Databricks supports both BI (SQL) and ML (Python/Spark) workloads on the same platform",
                        "Unity Catalog provides fine-grained governance and lineage required for UK GDPR and Ofgem audit",
                        "Preserves OAC investment — existing content and user skills are retained",
                        "Event-driven ingestion via Confluent achieves sub-15-minute latency targets"
                    ],
                    "cons": [
                        "Introduces new tooling (Databricks) requiring upskilling of Data Engineering team",
                        "OAC-to-Databricks connector is via JDBC — not natively certified by Oracle",
                        "Adds architectural complexity versus Option 2"
                    ]
                }
            ],